"No.","Time","Source","Destination","Protocol","Length","Info"
"1","0.000000","192.168.0.13","54.210.90.84","TCP","78","62387  >  5201 [SYN] Seq=0 Win=65535 Len=0 MSS=1460 WS=32 TSval=2935393052 TSecr=0 SACK_PERM=1"
"2","0.022937","54.210.90.84","192.168.0.13","TCP","74","5201  >  62387 [SYN, ACK] Seq=0 Ack=1 Win=26847 Len=0 MSS=1460 SACK_PERM=1 TSval=195578463 TSecr=2935393052 WS=128"
"3","0.022986","192.168.0.13","54.210.90.84","TCP","66","62387  >  5201 [ACK] Seq=1 Ack=1 Win=131744 Len=0 TSval=2935393075 TSecr=195578463"
"4","0.023027","192.168.0.13","54.210.90.84","TCP","103","62387  >  5201 [PSH, ACK] Seq=1 Ack=1 Win=131744 Len=37 TSval=2935393075 TSecr=195578463"
"5","0.049747","54.210.90.84","192.168.0.13","TCP","66","5201  >  62387 [ACK] Seq=1 Ack=38 Win=26880 Len=0 TSval=195578490 TSecr=2935393075"
"6","0.049749","54.210.90.84","192.168.0.13","TCP","66","[TCP Dup ACK 5#1] 5201  >  62387 [ACK] Seq=1 Ack=38 Win=26880 Len=0 TSval=195578490 TSecr=2935393075"
"7","0.051651","54.210.90.84","192.168.0.13","TCP","1514","5201  >  62387 [ACK] Seq=1 Ack=38 Win=26880 Len=1448 TSval=195578491 TSecr=2935393075"
"8","0.051654","54.210.90.84","192.168.0.13","TCP","1514","5201  >  62387 [ACK] Seq=1449 Ack=38 Win=26880 Len=1448 TSval=195578491 TSecr=2935393075"
"9","0.051657","54.210.90.84","192.168.0.13","TCP","1514","5201  >  62387 [ACK] Seq=2897 Ack=38 Win=26880 Len=1448 TSval=195578491 TSecr=2935393075"
"10","0.051660","54.210.90.84","192.168.0.13","TCP","1514","5201  >  62387 [ACK] Seq=4345 Ack=38 Win=26880 Len=1448 TSval=195578491 TSecr=2935393075"
"11","0.051696","192.168.0.13","54.210.90.84","TCP","66","62387  >  5201 [ACK] Seq=38 Ack=2897 Win=128864 Len=0 TSval=2935393102 TSecr=195578491"
"12","0.051713","192.168.0.13","54.210.90.84","TCP","66","62387  >  5201 [ACK] Seq=38 Ack=5793 Win=125952 Len=0 TSval=2935393102 TSecr=195578491"
"13","0.051717","54.210.90.84","192.168.0.13","TCP","1514","5201  >  62387 [ACK] Seq=5793 Ack=38 Win=26880 Len=1448 TSval=195578491 TSecr=2935393075"
"14","0.051877","54.210.90.84","192.168.0.13","TCP","1514","5201  >  62387 [ACK] Seq=7241 Ack=38 Win=26880 Len=1448 TSval=195578491 TSecr=2935393075"
"15","0.051882","54.210.90.84","192.168.0.13","TCP","1514","5201  >  62387 [ACK] Seq=8689 Ack=38 Win=26880 Len=1448 TSval=195578491 TSecr=2935393075"
"16","0.051905","192.168.0.13","54.210.90.84","TCP","66","62387  >  5201 [ACK] Seq=38 Ack=8689 Win=123072 Len=0 TSval=2935393102 TSecr=195578491"
"17","0.051927","54.210.90.84","192.168.0.13","TCP","1514","5201  >  62387 [ACK] Seq=10137 Ack=38 Win=26880 Len=1448 TSval=195578491 TSecr=2935393075"
"18","0.051934","192.168.0.13","54.210.90.84","TCP","66","62387  >  5201 [ACK] Seq=38 Ack=11585 Win=120160 Len=0 TSval=2935393102 TSecr=195578491"
"19","0.053067","54.210.90.84","192.168.0.13","TCP","1514","5201  >  62387 [ACK] Seq=11585 Ack=38 Win=26880 Len=1448 TSval=195578491 TSecr=2935393075"
"20","0.053070","54.210.90.84","192.168.0.13","TCP","1514","5201  >  62387 [ACK] Seq=13033 Ack=38 Win=26880 Len=1448 TSval=195578491 TSecr=2935393075"
"21","0.053087","192.168.0.13","54.210.90.84","TCP","66","62387  >  5201 [ACK] Seq=38 Ack=14481 Win=117280 Len=0 TSval=2935393104 TSecr=195578491"
"22","0.080764","192.168.0.13","54.210.90.84","TCP","66","[TCP Window Update] 62387  >  5201 [ACK] Seq=38 Ack=14481 Win=131072 Len=0 TSval=2935393131 TSecr=195578491"
"23","0.083054","54.210.90.84","192.168.0.13","TCP","1514","5201  >  62387 [ACK] Seq=14481 Ack=38 Win=26880 Len=1448 TSval=195578521 TSecr=2935393102"
"24","0.083058","54.210.90.84","192.168.0.13","TCP","1514","5201  >  62387 [ACK] Seq=15929 Ack=38 Win=26880 Len=1448 TSval=195578521 TSecr=2935393102"
"25","0.083060","54.210.90.84","192.168.0.13","TCP","1514","5201  >  62387 [ACK] Seq=17377 Ack=38 Win=26880 Len=1448 TSval=195578521 TSecr=2935393102"
"26","0.083063","54.210.90.84","192.168.0.13","TCP","1514","5201  >  62387 [ACK] Seq=18825 Ack=38 Win=26880 Len=1448 TSval=195578521 TSecr=2935393102"
"27","0.083097","192.168.0.13","54.210.90.84","TCP","66","62387  >  5201 [ACK] Seq=38 Ack=17377 Win=128160 Len=0 TSval=2935393133 TSecr=195578521"
"28","0.083105","192.168.0.13","54.210.90.84","TCP","66","[TCP Window Update] 62387  >  5201 [ACK] Seq=38 Ack=17377 Win=131072 Len=0 TSval=2935393133 TSecr=195578521"
"29","0.083126","192.168.0.13","54.210.90.84","TCP","66","62387  >  5201 [ACK] Seq=38 Ack=20273 Win=128160 Len=0 TSval=2935393133 TSecr=195578521"
"30","0.083131","192.168.0.13","54.210.90.84","TCP","66","[TCP Window Update] 62387  >  5201 [ACK] Seq=38 Ack=20273 Win=131072 Len=0 TSval=2935393133 TSecr=195578521"
"31","0.084887","54.210.90.84","192.168.0.13","TCP","1514","5201  >  62387 [ACK] Seq=20273 Ack=38 Win=26880 Len=1448 TSval=195578521 TSecr=2935393104"
"32","0.084890","54.210.90.84","192.168.0.13","TCP","1514","5201  >  62387 [ACK] Seq=21721 Ack=38 Win=26880 Len=1448 TSval=195578521 TSecr=2935393104"
"33","0.084892","54.210.90.84","192.168.0.13","TCP","1514","5201  >  62387 [ACK] Seq=23169 Ack=38 Win=26880 Len=1448 TSval=195578521 TSecr=2935393104"
"34","0.084894","54.210.90.84","192.168.0.13","TCP","1514","5201  >  62387 [ACK] Seq=24617 Ack=38 Win=26880 Len=1448 TSval=195578521 TSecr=2935393104"
"35","0.084921","192.168.0.13","54.210.90.84","TCP","66","62387  >  5201 [ACK] Seq=38 Ack=23169 Win=128160 Len=0 TSval=2935393134 TSecr=195578521"
"36","0.084930","192.168.0.13","54.210.90.84","TCP","66","[TCP Window Update] 62387  >  5201 [ACK] Seq=38 Ack=23169 Win=131072 Len=0 TSval=2935393134 TSecr=195578521"
"37","0.084939","192.168.0.13","54.210.90.84","TCP","66","62387  >  5201 [ACK] Seq=38 Ack=26065 Win=128160 Len=0 TSval=2935393134 TSecr=195578521"
"38","0.084952","192.168.0.13","54.210.90.84","TCP","66","[TCP Window Update] 62387  >  5201 [ACK] Seq=38 Ack=26065 Win=131072 Len=0 TSval=2935393134 TSecr=195578521"
"39","0.085125","54.210.90.84","192.168.0.13","TCP","1514","5201  >  62387 [ACK] Seq=26065 Ack=38 Win=26880 Len=1448 TSval=195578521 TSecr=2935393104"
"40","0.085129","54.210.90.84","192.168.0.13","TCP","1514","5201  >  62387 [ACK] Seq=27513 Ack=38 Win=26880 Len=1448 TSval=195578521 TSecr=2935393104"
"41","0.085158","192.168.0.13","54.210.90.84","TCP","66","62387  >  5201 [ACK] Seq=38 Ack=28961 Win=128160 Len=0 TSval=2935393134 TSecr=195578521"
"42","0.085164","192.168.0.13","54.210.90.84","TCP","66","[TCP Window Update] 62387  >  5201 [ACK] Seq=38 Ack=28961 Win=131072 Len=0 TSval=2935393134 TSecr=195578521"
"43","0.086655","54.210.90.84","192.168.0.13","TCP","1514","5201  >  62387 [ACK] Seq=28961 Ack=38 Win=26880 Len=1448 TSval=195578521 TSecr=2935393104"
"44","0.086659","54.210.90.84","192.168.0.13","TCP","1514","5201  >  62387 [ACK] Seq=30409 Ack=38 Win=26880 Len=1448 TSval=195578521 TSecr=2935393104"
"45","0.086662","54.210.90.84","192.168.0.13","TCP","1514","5201  >  62387 [ACK] Seq=31857 Ack=38 Win=26880 Len=1448 TSval=195578521 TSecr=2935393104"
"46","0.086665","54.210.90.84","192.168.0.13","TCP","1514","5201  >  62387 [ACK] Seq=33305 Ack=38 Win=26880 Len=1448 TSval=195578521 TSecr=2935393104"
"47","0.086668","54.210.90.84","192.168.0.13","TCP","1514","5201  >  62387 [ACK] Seq=34753 Ack=38 Win=26880 Len=1448 TSval=195578521 TSecr=2935393104"
"48","0.086670","54.210.90.84","192.168.0.13","TCP","1514","5201  >  62387 [ACK] Seq=36201 Ack=38 Win=26880 Len=1448 TSval=195578521 TSecr=2935393104"
"49","0.086673","54.210.90.84","192.168.0.13","TCP","1514","5201  >  62387 [ACK] Seq=37649 Ack=38 Win=26880 Len=1448 TSval=195578521 TSecr=2935393104"
"50","0.086709","192.168.0.13","54.210.90.84","TCP","66","62387  >  5201 [ACK] Seq=38 Ack=31857 Win=128160 Len=0 TSval=2935393135 TSecr=195578521"
"51","0.086720","192.168.0.13","54.210.90.84","TCP","66","[TCP Window Update] 62387  >  5201 [ACK] Seq=38 Ack=31857 Win=131072 Len=0 TSval=2935393135 TSecr=195578521"
"52","0.086741","192.168.0.13","54.210.90.84","TCP","66","62387  >  5201 [ACK] Seq=38 Ack=34753 Win=128160 Len=0 TSval=2935393135 TSecr=195578521"
"53","0.086754","192.168.0.13","54.210.90.84","TCP","66","[TCP Window Update] 62387  >  5201 [ACK] Seq=38 Ack=34753 Win=131072 Len=0 TSval=2935393135 TSecr=195578521"
"54","0.086756","54.210.90.84","192.168.0.13","TCP","1514","5201  >  62387 [ACK] Seq=39097 Ack=38 Win=26880 Len=1448 TSval=195578521 TSecr=2935393104"
"55","0.086759","54.210.90.84","192.168.0.13","TCP","1514","5201  >  62387 [ACK] Seq=40545 Ack=38 Win=26880 Len=1448 TSval=195578521 TSecr=2935393104"
"56","0.086760","54.210.90.84","192.168.0.13","TCP","1514","5201  >  62387 [ACK] Seq=41993 Ack=38 Win=26880 Len=1448 TSval=195578521 TSecr=2935393104"
"57","0.086762","192.168.0.13","54.210.90.84","TCP","66","62387  >  5201 [ACK] Seq=38 Ack=37649 Win=128160 Len=0 TSval=2935393135 TSecr=195578521"
"58","0.086764","192.168.0.13","54.210.90.84","TCP","66","62387  >  5201 [ACK] Seq=38 Ack=39097 Win=126720 Len=0 TSval=2935393135 TSecr=195578521"
"59","0.086770","192.168.0.13","54.210.90.84","TCP","66","62387  >  5201 [ACK] Seq=38 Ack=41993 Win=123808 Len=0 TSval=2935393135 TSecr=195578521"
"60","0.086774","192.168.0.13","54.210.90.84","TCP","66","[TCP Window Update] 62387  >  5201 [ACK] Seq=38 Ack=41993 Win=131072 Len=0 TSval=2935393135 TSecr=195578521"
"61","0.104544","54.210.90.84","192.168.0.13","TCP","1514","5201  >  62387 [ACK] Seq=43441 Ack=38 Win=26880 Len=1448 TSval=195578544 TSecr=2935393133"
"62","0.104587","192.168.0.13","54.210.90.84","TCP","66","62387  >  5201 [ACK] Seq=38 Ack=44889 Win=129600 Len=0 TSval=2935393152 TSecr=195578521"
"63","0.105934","54.210.90.84","192.168.0.13","TCP","1514","5201  >  62387 [ACK] Seq=44889 Ack=38 Win=26880 Len=1448 TSval=195578544 TSecr=2935393133"
"64","0.105937","54.210.90.84","192.168.0.13","TCP","1514","5201  >  62387 [ACK] Seq=46337 Ack=38 Win=26880 Len=1448 TSval=195578544 TSecr=2935393133"
"65","0.105940","54.210.90.84","192.168.0.13","TCP","1514","5201  >  62387 [ACK] Seq=47785 Ack=38 Win=26880 Len=1448 TSval=195578544 TSecr=2935393133"
"66","0.105977","192.168.0.13","54.210.90.84","TCP","66","62387  >  5201 [ACK] Seq=38 Ack=47785 Win=128160 Len=0 TSval=2935393153 TSecr=195578544"
"67","0.106006","192.168.0.13","54.210.90.84","TCP","66","62387  >  5201 [ACK] Seq=38 Ack=49233 Win=131072 Len=0 TSval=2935393153 TSecr=195578544"
"68","0.113452","54.210.90.84","192.168.0.13","TCP","1514","5201  >  62387 [ACK] Seq=49233 Ack=38 Win=26880 Len=1448 TSval=195578551 TSecr=2935393134"
"69","0.113456","54.210.90.84","192.168.0.13","TCP","1514","5201  >  62387 [ACK] Seq=50681 Ack=38 Win=26880 Len=1448 TSval=195578551 TSecr=2935393134"
"70","0.113458","54.210.90.84","192.168.0.13","TCP","1514","5201  >  62387 [ACK] Seq=52129 Ack=38 Win=26880 Len=1448 TSval=195578551 TSecr=2935393134"
"71","0.113461","54.210.90.84","192.168.0.13","TCP","1514","5201  >  62387 [ACK] Seq=53577 Ack=38 Win=26880 Len=1448 TSval=195578551 TSecr=2935393134"
"72","0.113553","192.168.0.13","54.210.90.84","TCP","66","62387  >  5201 [ACK] Seq=38 Ack=50681 Win=129600 Len=0 TSval=2935393160 TSecr=195578551"
"73","0.113581","192.168.0.13","54.210.90.84","TCP","66","62387  >  5201 [ACK] Seq=38 Ack=53577 Win=126720 Len=0 TSval=2935393160 TSecr=195578551"
"74","0.113589","54.210.90.84","192.168.0.13","TCP","1514","5201  >  62387 [ACK] Seq=55025 Ack=38 Win=26880 Len=1448 TSval=195578551 TSecr=2935393135"
"75","0.113592","54.210.90.84","192.168.0.13","TCP","1514","5201  >  62387 [ACK] Seq=56473 Ack=38 Win=26880 Len=1448 TSval=195578551 TSecr=2935393135"
"76","0.113594","54.210.90.84","192.168.0.13","TCP","1514","5201  >  62387 [ACK] Seq=57921 Ack=38 Win=26880 Len=1448 TSval=195578551 TSecr=2935393135"
"77","0.113604","192.168.0.13","54.210.90.84","TCP","66","62387  >  5201 [ACK] Seq=38 Ack=56473 Win=123808 Len=0 TSval=2935393160 TSecr=195578551"
"78","0.113614","192.168.0.13","54.210.90.84","TCP","66","62387  >  5201 [ACK] Seq=38 Ack=59369 Win=120928 Len=0 TSval=2935393160 TSecr=195578551"
"79","0.113696","192.168.0.13","54.210.90.84","TCP","66","[TCP Window Update] 62387  >  5201 [ACK] Seq=38 Ack=59369 Win=131072 Len=0 TSval=2935393160 TSecr=195578551"
"80","0.113716","54.210.90.84","192.168.0.13","TCP","1514","5201  >  62387 [ACK] Seq=59369 Ack=38 Win=26880 Len=1448 TSval=195578551 TSecr=2935393135"
"81","0.113719","54.210.90.84","192.168.0.13","TCP","1514","5201  >  62387 [ACK] Seq=60817 Ack=38 Win=26880 Len=1448 TSval=195578551 TSecr=2935393135"
"82","0.113741","192.168.0.13","54.210.90.84","TCP","66","62387  >  5201 [ACK] Seq=38 Ack=62265 Win=129600 Len=0 TSval=2935393160 TSecr=195578551"
"83","0.113862","54.210.90.84","192.168.0.13","TCP","1514","5201  >  62387 [ACK] Seq=62265 Ack=38 Win=26880 Len=1448 TSval=195578551 TSecr=2935393135"
"84","0.113865","54.210.90.84","192.168.0.13","TCP","1514","5201  >  62387 [ACK] Seq=63713 Ack=38 Win=26880 Len=1448 TSval=195578551 TSecr=2935393135"
"85","0.113885","192.168.0.13","54.210.90.84","TCP","66","62387  >  5201 [ACK] Seq=38 Ack=65161 Win=128160 Len=0 TSval=2935393160 TSecr=195578551"
"86","0.113912","192.168.0.13","54.210.90.84","TCP","66","[TCP Window Update] 62387  >  5201 [ACK] Seq=38 Ack=65161 Win=131072 Len=0 TSval=2935393160 TSecr=195578551"
"87","0.114009","54.210.90.84","192.168.0.13","TCP","1514","5201  >  62387 [ACK] Seq=65161 Ack=38 Win=26880 Len=1448 TSval=195578551 TSecr=2935393135"
"88","0.114012","54.210.90.84","192.168.0.13","TCP","1514","5201  >  62387 [ACK] Seq=66609 Ack=38 Win=26880 Len=1448 TSval=195578551 TSecr=2935393135"
"89","0.114037","192.168.0.13","54.210.90.84","TCP","66","62387  >  5201 [ACK] Seq=38 Ack=68057 Win=128160 Len=0 TSval=2935393160 TSecr=195578551"
"90","0.114046","192.168.0.13","54.210.90.84","TCP","66","[TCP Window Update] 62387  >  5201 [ACK] Seq=38 Ack=68057 Win=131072 Len=0 TSval=2935393160 TSecr=195578551"
"91","0.114144","54.210.90.84","192.168.0.13","TCP","1514","5201  >  62387 [ACK] Seq=68057 Ack=38 Win=26880 Len=1448 TSval=195578551 TSecr=2935393135"
"92","0.114146","54.210.90.84","192.168.0.13","TCP","1514","5201  >  62387 [ACK] Seq=69505 Ack=38 Win=26880 Len=1448 TSval=195578551 TSecr=2935393135"
"93","0.114166","192.168.0.13","54.210.90.84","TCP","66","62387  >  5201 [ACK] Seq=38 Ack=70953 Win=128160 Len=0 TSval=2935393160 TSecr=195578551"
"94","0.114174","192.168.0.13","54.210.90.84","TCP","66","[TCP Window Update] 62387  >  5201 [ACK] Seq=38 Ack=70953 Win=131072 Len=0 TSval=2935393160 TSecr=195578551"
"95","0.114382","54.210.90.84","192.168.0.13","TCP","1514","5201  >  62387 [ACK] Seq=70953 Ack=38 Win=26880 Len=1448 TSval=195578551 TSecr=2935393135"
"96","0.114385","54.210.90.84","192.168.0.13","TCP","1514","5201  >  62387 [ACK] Seq=72401 Ack=38 Win=26880 Len=1448 TSval=195578551 TSecr=2935393135"
"97","0.114387","54.210.90.84","192.168.0.13","TCP","1514","5201  >  62387 [ACK] Seq=73849 Ack=38 Win=26880 Len=1448 TSval=195578551 TSecr=2935393135"
"98","0.114407","192.168.0.13","54.210.90.84","TCP","66","62387  >  5201 [ACK] Seq=38 Ack=73849 Win=128160 Len=0 TSval=2935393160 TSecr=195578551"
"99","0.114412","192.168.0.13","54.210.90.84","TCP","66","[TCP Window Update] 62387  >  5201 [ACK] Seq=38 Ack=73849 Win=131072 Len=0 TSval=2935393160 TSecr=195578551"
"100","0.115378","54.210.90.84","192.168.0.13","TCP","1514","5201  >  62387 [PSH, ACK] Seq=75297 Ack=38 Win=26880 Len=1448 TSval=195578551 TSecr=2935393135"
"101","0.115385","54.210.90.84","192.168.0.13","TCP","1514","5201  >  62387 [ACK] Seq=76745 Ack=38 Win=26880 Len=1448 TSval=195578551 TSecr=2935393135"
"102","0.115392","54.210.90.84","192.168.0.13","TCP","1514","5201  >  62387 [ACK] Seq=78193 Ack=38 Win=26880 Len=1448 TSval=195578551 TSecr=2935393135"
"103","0.115398","54.210.90.84","192.168.0.13","TCP","1514","5201  >  62387 [ACK] Seq=79641 Ack=38 Win=26880 Len=1448 TSval=195578551 TSecr=2935393135"
"104","0.115502","192.168.0.13","54.210.90.84","TCP","66","62387  >  5201 [ACK] Seq=38 Ack=76745 Win=129600 Len=0 TSval=2935393161 TSecr=195578551"
"105","0.115550","192.168.0.13","54.210.90.84","TCP","66","62387  >  5201 [ACK] Seq=38 Ack=79641 Win=126720 Len=0 TSval=2935393161 TSecr=195578551"
"106","0.115572","54.210.90.84","192.168.0.13","TCP","1514","5201  >  62387 [ACK] Seq=81089 Ack=38 Win=26880 Len=1448 TSval=195578551 TSecr=2935393135"
"107","0.115579","54.210.90.84","192.168.0.13","TCP","1514","5201  >  62387 [ACK] Seq=82537 Ack=38 Win=26880 Len=1448 TSval=195578551 TSecr=2935393135"
"108","0.115585","54.210.90.84","192.168.0.13","TCP","1514","5201  >  62387 [ACK] Seq=83985 Ack=38 Win=26880 Len=1448 TSval=195578551 TSecr=2935393135"
"109","0.115594","54.210.90.84","192.168.0.13","TCP","1514","5201  >  62387 [ACK] Seq=85433 Ack=38 Win=26880 Len=1448 TSval=195578551 TSecr=2935393135"
"110","0.115599","54.210.90.84","192.168.0.13","TCP","1514","5201  >  62387 [ACK] Seq=86881 Ack=38 Win=26880 Len=1448 TSval=195578551 TSecr=2935393135"
"111","0.115607","54.210.90.84","192.168.0.13","TCP","1514","5201  >  62387 [ACK] Seq=88329 Ack=38 Win=26880 Len=1448 TSval=195578551 TSecr=2935393135"
"112","0.115642","192.168.0.13","54.210.90.84","TCP","66","62387  >  5201 [ACK] Seq=38 Ack=82537 Win=123808 Len=0 TSval=2935393161 TSecr=195578551"
"113","0.115685","192.168.0.13","54.210.90.84","TCP","66","62387  >  5201 [ACK] Seq=38 Ack=85433 Win=120928 Len=0 TSval=2935393161 TSecr=195578551"
"114","0.115710","192.168.0.13","54.210.90.84","TCP","66","62387  >  5201 [ACK] Seq=38 Ack=88329 Win=118016 Len=0 TSval=2935393161 TSecr=195578551"
"115","0.115780","54.210.90.84","192.168.0.13","TCP","1514","5201  >  62387 [ACK] Seq=89777 Ack=38 Win=26880 Len=1448 TSval=195578551 TSecr=2935393135"
"116","0.115784","54.210.90.84","192.168.0.13","TCP","1514","5201  >  62387 [ACK] Seq=91225 Ack=38 Win=26880 Len=1448 TSval=195578551 TSecr=2935393135"
"117","0.115787","54.210.90.84","192.168.0.13","TCP","1514","5201  >  62387 [ACK] Seq=92673 Ack=38 Win=26880 Len=1448 TSval=195578551 TSecr=2935393135"
"118","0.115804","192.168.0.13","54.210.90.84","TCP","66","62387  >  5201 [ACK] Seq=38 Ack=89777 Win=131072 Len=0 TSval=2935393161 TSecr=195578551"
"119","0.115825","192.168.0.13","54.210.90.84","TCP","66","62387  >  5201 [ACK] Seq=38 Ack=92673 Win=128160 Len=0 TSval=2935393161 TSecr=195578551"
"120","0.115826","192.168.0.13","54.210.90.84","TCP","66","62387  >  5201 [ACK] Seq=38 Ack=94121 Win=126720 Len=0 TSval=2935393161 TSecr=195578551"
"121","0.115964","54.210.90.84","192.168.0.13","TCP","1514","5201  >  62387 [ACK] Seq=94121 Ack=38 Win=26880 Len=1448 TSval=195578551 TSecr=2935393135"
"122","0.115967","54.210.90.84","192.168.0.13","TCP","1514","5201  >  62387 [ACK] Seq=95569 Ack=38 Win=26880 Len=1448 TSval=195578551 TSecr=2935393135"
"123","0.115988","192.168.0.13","54.210.90.84","TCP","66","62387  >  5201 [ACK] Seq=38 Ack=97017 Win=123808 Len=0 TSval=2935393161 TSecr=195578551"
"124","0.116429","192.168.0.13","54.210.90.84","TCP","66","[TCP Window Update] 62387  >  5201 [ACK] Seq=38 Ack=97017 Win=131072 Len=0 TSval=2935393161 TSecr=195578551"
"125","0.125357","54.210.90.84","192.168.0.13","TCP","1514","5201  >  62387 [ACK] Seq=97017 Ack=38 Win=26880 Len=1448 TSval=195578565 TSecr=2935393153"
"126","0.125360","54.210.90.84","192.168.0.13","TCP","1514","5201  >  62387 [ACK] Seq=98465 Ack=38 Win=26880 Len=1448 TSval=195578565 TSecr=2935393153"
"127","0.125361","54.210.90.84","192.168.0.13","TCP","1514","5201  >  62387 [ACK] Seq=99913 Ack=38 Win=26880 Len=1448 TSval=195578565 TSecr=2935393153"
"128","0.125410","192.168.0.13","54.210.90.84","TCP","66","62387  >  5201 [ACK] Seq=38 Ack=99913 Win=128160 Len=0 TSval=2935393170 TSecr=195578565"
"129","0.125419","192.168.0.13","54.210.90.84","TCP","66","[TCP Window Update] 62387  >  5201 [ACK] Seq=38 Ack=99913 Win=131072 Len=0 TSval=2935393170 TSecr=195578565"
"130","0.125464","54.210.90.84","192.168.0.13","TCP","1514","5201  >  62387 [ACK] Seq=101361 Ack=38 Win=26880 Len=1448 TSval=195578565 TSecr=2935393153"
"131","0.125466","54.210.90.84","192.168.0.13","TCP","1514","5201  >  62387 [ACK] Seq=102809 Ack=38 Win=26880 Len=1448 TSval=195578565 TSecr=2935393153"
"132","0.125470","54.210.90.84","192.168.0.13","TCP","1514","5201  >  62387 [ACK] Seq=104257 Ack=38 Win=26880 Len=1448 TSval=195578565 TSecr=2935393153"
"133","0.125499","192.168.0.13","54.210.90.84","TCP","66","62387  >  5201 [ACK] Seq=38 Ack=102809 Win=129600 Len=0 TSval=2935393170 TSecr=195578565"
"134","0.125521","192.168.0.13","54.210.90.84","TCP","66","62387  >  5201 [ACK] Seq=38 Ack=105705 Win=128160 Len=0 TSval=2935393170 TSecr=195578565"
"135","0.125537","192.168.0.13","54.210.90.84","TCP","66","[TCP Window Update] 62387  >  5201 [ACK] Seq=38 Ack=105705 Win=131072 Len=0 TSval=2935393170 TSecr=195578565"
"136","0.125591","54.210.90.84","192.168.0.13","TCP","1514","5201  >  62387 [ACK] Seq=105705 Ack=38 Win=26880 Len=1448 TSval=195578565 TSecr=2935393153"
"137","0.126548","54.210.90.84","192.168.0.13","TCP","1514","5201  >  62387 [ACK] Seq=107153 Ack=38 Win=26880 Len=1448 TSval=195578565 TSecr=2935393153"
"138","0.126551","54.210.90.84","192.168.0.13","TCP","1514","5201  >  62387 [ACK] Seq=108601 Ack=38 Win=26880 Len=1448 TSval=195578565 TSecr=2935393153"
"139","0.126554","54.210.90.84","192.168.0.13","TCP","1514","5201  >  62387 [ACK] Seq=110049 Ack=38 Win=26880 Len=1448 TSval=195578565 TSecr=2935393153"
"140","0.126557","54.210.90.84","192.168.0.13","TCP","1514","5201  >  62387 [ACK] Seq=111497 Ack=38 Win=26880 Len=1448 TSval=195578565 TSecr=2935393153"
"141","0.126599","192.168.0.13","54.210.90.84","TCP","66","62387  >  5201 [ACK] Seq=38 Ack=108601 Win=129600 Len=0 TSval=2935393171 TSecr=195578565"
"142","0.126621","192.168.0.13","54.210.90.84","TCP","66","62387  >  5201 [ACK] Seq=38 Ack=111497 Win=128160 Len=0 TSval=2935393171 TSecr=195578565"
"143","0.126625","192.168.0.13","54.210.90.84","TCP","66","[TCP Window Update] 62387  >  5201 [ACK] Seq=38 Ack=111497 Win=131072 Len=0 TSval=2935393171 TSecr=195578565"
"144","0.131334","54.210.90.84","192.168.0.13","TCP","1514","5201  >  62387 [ACK] Seq=112945 Ack=38 Win=26880 Len=1448 TSval=195578571 TSecr=2935393160"
"145","0.131337","54.210.90.84","192.168.0.13","TCP","1514","5201  >  62387 [ACK] Seq=114393 Ack=38 Win=26880 Len=1448 TSval=195578571 TSecr=2935393160"
"146","0.131339","54.210.90.84","192.168.0.13","TCP","1514","5201  >  62387 [ACK] Seq=115841 Ack=38 Win=26880 Len=1448 TSval=195578571 TSecr=2935393160"
"147","0.131382","192.168.0.13","54.210.90.84","TCP","66","62387  >  5201 [ACK] Seq=38 Ack=114393 Win=129600 Len=0 TSval=2935393175 TSecr=195578565"
"148","0.131400","192.168.0.13","54.210.90.84","TCP","66","62387  >  5201 [ACK] Seq=38 Ack=117289 Win=128160 Len=0 TSval=2935393175 TSecr=195578571"
"149","0.131404","192.168.0.13","54.210.90.84","TCP","66","[TCP Window Update] 62387  >  5201 [ACK] Seq=38 Ack=117289 Win=131072 Len=0 TSval=2935393175 TSecr=195578571"
"150","0.131408","54.210.90.84","192.168.0.13","TCP","1514","5201  >  62387 [ACK] Seq=117289 Ack=38 Win=26880 Len=1448 TSval=195578571 TSecr=2935393160"
"151","0.131410","54.210.90.84","192.168.0.13","TCP","1514","5201  >  62387 [ACK] Seq=118737 Ack=38 Win=26880 Len=1448 TSval=195578571 TSecr=2935393160"
"152","0.131425","192.168.0.13","54.210.90.84","TCP","66","62387  >  5201 [ACK] Seq=38 Ack=120185 Win=128160 Len=0 TSval=2935393175 TSecr=195578571"
"153","0.131429","192.168.0.13","54.210.90.84","TCP","66","[TCP Window Update] 62387  >  5201 [ACK] Seq=38 Ack=120185 Win=131072 Len=0 TSval=2935393175 TSecr=195578571"
"154","0.131646","54.210.90.84","192.168.0.13","TCP","1514","5201  >  62387 [ACK] Seq=120185 Ack=38 Win=26880 Len=1448 TSval=195578571 TSecr=2935393160"
"155","0.131648","54.210.90.84","192.168.0.13","TCP","1514","5201  >  62387 [ACK] Seq=121633 Ack=38 Win=26880 Len=1448 TSval=195578571 TSecr=2935393160"
"156","0.131670","192.168.0.13","54.210.90.84","TCP","66","62387  >  5201 [ACK] Seq=38 Ack=123081 Win=128160 Len=0 TSval=2935393175 TSecr=195578571"
"157","0.131689","192.168.0.13","54.210.90.84","TCP","66","[TCP Window Update] 62387  >  5201 [ACK] Seq=38 Ack=123081 Win=131072 Len=0 TSval=2935393175 TSecr=195578571"
"158","0.131943","54.210.90.84","192.168.0.13","TCP","1514","5201  >  62387 [ACK] Seq=123081 Ack=38 Win=26880 Len=1448 TSval=195578571 TSecr=2935393160"
"159","0.133512","54.210.90.84","192.168.0.13","TCP","1514","5201  >  62387 [ACK] Seq=124529 Ack=38 Win=26880 Len=1448 TSval=195578571 TSecr=2935393160"
"160","0.133517","54.210.90.84","192.168.0.13","TCP","1514","5201  >  62387 [ACK] Seq=125977 Ack=38 Win=26880 Len=1448 TSval=195578571 TSecr=2935393160"
"161","0.133573","192.168.0.13","54.210.90.84","TCP","66","62387  >  5201 [ACK] Seq=38 Ack=125977 Win=129600 Len=0 TSval=2935393177 TSecr=195578571"
"162","0.133589","54.210.90.84","192.168.0.13","TCP","1514","5201  >  62387 [ACK] Seq=127425 Ack=38 Win=26880 Len=1448 TSval=195578571 TSecr=2935393160"
"163","0.133593","54.210.90.84","192.168.0.13","TCP","1514","5201  >  62387 [ACK] Seq=128873 Ack=38 Win=26880 Len=1448 TSval=195578571 TSecr=2935393160"
"164","0.133604","192.168.0.13","54.210.90.84","TCP","66","62387  >  5201 [ACK] Seq=38 Ack=128873 Win=126720 Len=0 TSval=2935393177 TSecr=195578571"
"165","0.133695","192.168.0.13","54.210.90.84","TCP","66","62387  >  5201 [ACK] Seq=38 Ack=130321 Win=131072 Len=0 TSval=2935393177 TSecr=195578571"
"166","0.142869","54.210.90.84","192.168.0.13","TCP","1514","5201  >  62387 [ACK] Seq=130321 Ack=38 Win=26880 Len=1448 TSval=195578583 TSecr=2935393160"
"167","0.142877","54.210.90.84","192.168.0.13","TCP","1514","5201  >  62387 [ACK] Seq=131769 Ack=38 Win=26880 Len=1448 TSval=195578583 TSecr=2935393160"
"168","0.142945","192.168.0.13","54.210.90.84","TCP","66","62387  >  5201 [ACK] Seq=38 Ack=133217 Win=128160 Len=0 TSval=2935393186 TSecr=195578583"
"169","0.142955","54.210.90.84","192.168.0.13","TCP","1514","5201  >  62387 [ACK] Seq=133217 Ack=38 Win=26880 Len=1448 TSval=195578583 TSecr=2935393160"
"170","0.142958","54.210.90.84","192.168.0.13","TCP","1514","5201  >  62387 [ACK] Seq=134665 Ack=38 Win=26880 Len=1448 TSval=195578583 TSecr=2935393160"
"171","0.143005","192.168.0.13","54.210.90.84","TCP","66","62387  >  5201 [ACK] Seq=38 Ack=134665 Win=131072 Len=0 TSval=2935393186 TSecr=195578583"
"172","0.143014","192.168.0.13","54.210.90.84","TCP","66","62387  >  5201 [ACK] Seq=38 Ack=136113 Win=129600 Len=0 TSval=2935393186 TSecr=195578583"
"173","0.143220","54.210.90.84","192.168.0.13","TCP","1514","5201  >  62387 [ACK] Seq=136113 Ack=38 Win=26880 Len=1448 TSval=195578583 TSecr=2935393160"
"174","0.143222","54.210.90.84","192.168.0.13","TCP","1514","5201  >  62387 [ACK] Seq=137561 Ack=38 Win=26880 Len=1448 TSval=195578583 TSecr=2935393160"
"175","0.143225","54.210.90.84","192.168.0.13","TCP","1514","5201  >  62387 [ACK] Seq=139009 Ack=38 Win=26880 Len=1448 TSval=195578583 TSecr=2935393171"
"176","0.143257","192.168.0.13","54.210.90.84","TCP","66","62387  >  5201 [ACK] Seq=38 Ack=139009 Win=128160 Len=0 TSval=2935393186 TSecr=195578583"
"177","0.143264","192.168.0.13","54.210.90.84","TCP","66","[TCP Window Update] 62387  >  5201 [ACK] Seq=38 Ack=139009 Win=131072 Len=0 TSval=2935393186 TSecr=195578583"
"178","0.143272","54.210.90.84","192.168.0.13","TCP","1514","5201  >  62387 [PSH, ACK] Seq=140457 Ack=38 Win=26880 Len=1448 TSval=195578583 TSecr=2935393171"
"179","0.143289","192.168.0.13","54.210.90.84","TCP","66","62387  >  5201 [ACK] Seq=38 Ack=141905 Win=129600 Len=0 TSval=2935393186 TSecr=195578583"
"180","0.143528","54.210.90.84","192.168.0.13","TCP","1514","5201  >  62387 [ACK] Seq=141905 Ack=38 Win=26880 Len=1448 TSval=195578583 TSecr=2935393171"
"181","0.143530","54.210.90.84","192.168.0.13","TCP","1514","5201  >  62387 [ACK] Seq=143353 Ack=38 Win=26880 Len=1448 TSval=195578583 TSecr=2935393171"
"182","0.143533","54.210.90.84","192.168.0.13","TCP","1514","5201  >  62387 [ACK] Seq=144801 Ack=38 Win=26880 Len=1448 TSval=195578583 TSecr=2935393171"
"183","0.143535","54.210.90.84","192.168.0.13","TCP","1514","5201  >  62387 [ACK] Seq=146249 Ack=38 Win=26880 Len=1448 TSval=195578583 TSecr=2935393171"
"184","0.143550","192.168.0.13","54.210.90.84","TCP","66","62387  >  5201 [ACK] Seq=38 Ack=144801 Win=128160 Len=0 TSval=2935393186 TSecr=195578583"
"185","0.143558","192.168.0.13","54.210.90.84","TCP","66","62387  >  5201 [ACK] Seq=38 Ack=147697 Win=125280 Len=0 TSval=2935393186 TSecr=195578583"
"186","0.143597","192.168.0.13","54.210.90.84","TCP","66","[TCP Window Update] 62387  >  5201 [ACK] Seq=38 Ack=147697 Win=131072 Len=0 TSval=2935393186 TSecr=195578583"
"187","0.143640","54.210.90.84","192.168.0.13","TCP","1514","5201  >  62387 [ACK] Seq=147697 Ack=38 Win=26880 Len=1448 TSval=195578583 TSecr=2935393171"
"188","0.143643","54.210.90.84","192.168.0.13","TCP","1514","5201  >  62387 [ACK] Seq=149145 Ack=38 Win=26880 Len=1448 TSval=195578583 TSecr=2935393171"
"189","0.143660","192.168.0.13","54.210.90.84","TCP","66","62387  >  5201 [ACK] Seq=38 Ack=150593 Win=128160 Len=0 TSval=2935393186 TSecr=195578583"
"190","0.143668","192.168.0.13","54.210.90.84","TCP","66","[TCP Window Update] 62387  >  5201 [ACK] Seq=38 Ack=150593 Win=131072 Len=0 TSval=2935393186 TSecr=195578583"
"191","0.144078","54.210.90.84","192.168.0.13","TCP","1514","5201  >  62387 [ACK] Seq=150593 Ack=38 Win=26880 Len=1448 TSval=195578583 TSecr=2935393171"
"192","0.144081","54.210.90.84","192.168.0.13","TCP","1514","5201  >  62387 [ACK] Seq=152041 Ack=38 Win=26880 Len=1448 TSval=195578583 TSecr=2935393171"
"193","0.144084","54.210.90.84","192.168.0.13","TCP","1514","5201  >  62387 [ACK] Seq=153489 Ack=38 Win=26880 Len=1448 TSval=195578583 TSecr=2935393171"
"194","0.144087","54.210.90.84","192.168.0.13","TCP","1514","5201  >  62387 [ACK] Seq=154937 Ack=38 Win=26880 Len=1448 TSval=195578583 TSecr=2935393171"
"195","0.144107","192.168.0.13","54.210.90.84","TCP","66","62387  >  5201 [ACK] Seq=38 Ack=153489 Win=128160 Len=0 TSval=2935393187 TSecr=195578583"
"196","0.144114","192.168.0.13","54.210.90.84","TCP","66","[TCP Window Update] 62387  >  5201 [ACK] Seq=38 Ack=153489 Win=131072 Len=0 TSval=2935393187 TSecr=195578583"
"197","0.144126","192.168.0.13","54.210.90.84","TCP","66","62387  >  5201 [ACK] Seq=38 Ack=156385 Win=128160 Len=0 TSval=2935393187 TSecr=195578583"
"198","0.144130","54.210.90.84","192.168.0.13","TCP","1514","5201  >  62387 [ACK] Seq=156385 Ack=38 Win=26880 Len=1448 TSval=195578583 TSecr=2935393171"
"199","0.144147","192.168.0.13","54.210.90.84","TCP","66","[TCP Window Update] 62387  >  5201 [ACK] Seq=38 Ack=156385 Win=131072 Len=0 TSval=2935393187 TSecr=195578583"
"200","0.144277","54.210.90.84","192.168.0.13","TCP","1514","5201  >  62387 [ACK] Seq=157833 Ack=38 Win=26880 Len=1448 TSval=195578583 TSecr=2935393171"
"201","0.144279","54.210.90.84","192.168.0.13","TCP","1514","5201  >  62387 [ACK] Seq=159281 Ack=38 Win=26880 Len=1448 TSval=195578583 TSecr=2935393171"
"202","0.144301","192.168.0.13","54.210.90.84","TCP","66","62387  >  5201 [ACK] Seq=38 Ack=159281 Win=129600 Len=0 TSval=2935393187 TSecr=195578583"
"203","0.144326","192.168.0.13","54.210.90.84","TCP","66","62387  >  5201 [ACK] Seq=38 Ack=160729 Win=131072 Len=0 TSval=2935393187 TSecr=195578583"
"204","0.144400","54.210.90.84","192.168.0.13","TCP","1514","5201  >  62387 [ACK] Seq=160729 Ack=38 Win=26880 Len=1448 TSval=195578583 TSecr=2935393171"
"205","0.144402","54.210.90.84","192.168.0.13","TCP","1514","5201  >  62387 [ACK] Seq=162177 Ack=38 Win=26880 Len=1448 TSval=195578583 TSecr=2935393171"
"206","0.144420","192.168.0.13","54.210.90.84","TCP","66","62387  >  5201 [ACK] Seq=38 Ack=163625 Win=128160 Len=0 TSval=2935393187 TSecr=195578583"
"207","0.144468","192.168.0.13","54.210.90.84","TCP","66","[TCP Window Update] 62387  >  5201 [ACK] Seq=38 Ack=163625 Win=131072 Len=0 TSval=2935393187 TSecr=195578583"
"208","0.144513","54.210.90.84","192.168.0.13","TCP","1514","5201  >  62387 [ACK] Seq=163625 Ack=38 Win=26880 Len=1448 TSval=195578583 TSecr=2935393171"
"209","0.144701","54.210.90.84","192.168.0.13","TCP","1514","5201  >  62387 [ACK] Seq=165073 Ack=38 Win=26880 Len=1448 TSval=195578583 TSecr=2935393171"
"210","0.144703","54.210.90.84","192.168.0.13","TCP","1514","5201  >  62387 [ACK] Seq=166521 Ack=38 Win=26880 Len=1448 TSval=195578583 TSecr=2935393171"
"211","0.144719","192.168.0.13","54.210.90.84","TCP","66","62387  >  5201 [ACK] Seq=38 Ack=166521 Win=129600 Len=0 TSval=2935393187 TSecr=195578583"
"212","0.144738","54.210.90.84","192.168.0.13","TCP","1514","5201  >  62387 [ACK] Seq=167969 Ack=38 Win=26880 Len=1448 TSval=195578583 TSecr=2935393171"
"213","0.144740","192.168.0.13","54.210.90.84","TCP","66","62387  >  5201 [ACK] Seq=38 Ack=167969 Win=131072 Len=0 TSval=2935393187 TSecr=195578583"
"214","0.144903","54.210.90.84","192.168.0.13","TCP","1514","5201  >  62387 [ACK] Seq=169417 Ack=38 Win=26880 Len=1448 TSval=195578583 TSecr=2935393171"
"215","0.144905","54.210.90.84","192.168.0.13","TCP","1514","5201  >  62387 [ACK] Seq=170865 Ack=38 Win=26880 Len=1448 TSval=195578583 TSecr=2935393171"
"216","0.144916","192.168.0.13","54.210.90.84","TCP","66","62387  >  5201 [ACK] Seq=38 Ack=170865 Win=129600 Len=0 TSval=2935393187 TSecr=195578583"
"217","0.144926","192.168.0.13","54.210.90.84","TCP","66","62387  >  5201 [ACK] Seq=38 Ack=172313 Win=131072 Len=0 TSval=2935393187 TSecr=195578583"
"218","0.145209","54.210.90.84","192.168.0.13","TCP","1514","5201  >  62387 [ACK] Seq=172313 Ack=38 Win=26880 Len=1448 TSval=195578583 TSecr=2935393171"
"219","0.145212","54.210.90.84","192.168.0.13","TCP","1514","5201  >  62387 [ACK] Seq=173761 Ack=38 Win=26880 Len=1448 TSval=195578583 TSecr=2935393171"
"220","0.145214","54.210.90.84","192.168.0.13","TCP","1514","5201  >  62387 [ACK] Seq=175209 Ack=38 Win=26880 Len=1448 TSval=195578583 TSecr=2935393171"
"221","0.145217","54.210.90.84","192.168.0.13","TCP","1514","5201  >  62387 [ACK] Seq=176657 Ack=38 Win=26880 Len=1448 TSval=195578583 TSecr=2935393171"
"222","0.145227","192.168.0.13","54.210.90.84","TCP","66","62387  >  5201 [ACK] Seq=38 Ack=173761 Win=129600 Len=0 TSval=2935393188 TSecr=195578583"
"223","0.145242","192.168.0.13","54.210.90.84","TCP","66","62387  >  5201 [ACK] Seq=38 Ack=176657 Win=128160 Len=0 TSval=2935393188 TSecr=195578583"
"224","0.145248","192.168.0.13","54.210.90.84","TCP","66","[TCP Window Update] 62387  >  5201 [ACK] Seq=38 Ack=176657 Win=131072 Len=0 TSval=2935393188 TSecr=195578583"
"225","0.145389","54.210.90.84","192.168.0.13","TCP","1514","5201  >  62387 [ACK] Seq=178105 Ack=38 Win=26880 Len=1448 TSval=195578583 TSecr=2935393171"
"226","0.145392","54.210.90.84","192.168.0.13","TCP","1514","5201  >  62387 [ACK] Seq=179553 Ack=38 Win=26880 Len=1448 TSval=195578583 TSecr=2935393171"
"227","0.145403","192.168.0.13","54.210.90.84","TCP","66","62387  >  5201 [ACK] Seq=38 Ack=179553 Win=129600 Len=0 TSval=2935393188 TSecr=195578583"
"228","0.145420","192.168.0.13","54.210.90.84","TCP","66","62387  >  5201 [ACK] Seq=38 Ack=181001 Win=131072 Len=0 TSval=2935393188 TSecr=195578583"
"229","0.145435","54.210.90.84","192.168.0.13","TCP","1514","5201  >  62387 [ACK] Seq=181001 Ack=38 Win=26880 Len=1448 TSval=195578583 TSecr=2935393171"
"230","0.149005","54.210.90.84","192.168.0.13","TCP","1514","5201  >  62387 [ACK] Seq=182449 Ack=38 Win=26880 Len=1448 TSval=195578583 TSecr=2935393171"
"231","0.149007","54.210.90.84","192.168.0.13","TCP","1514","5201  >  62387 [ACK] Seq=183897 Ack=38 Win=26880 Len=1448 TSval=195578583 TSecr=2935393171"
"232","0.149022","192.168.0.13","54.210.90.84","TCP","66","62387  >  5201 [ACK] Seq=38 Ack=183897 Win=129600 Len=0 TSval=2935393191 TSecr=195578583"
"233","0.149038","192.168.0.13","54.210.90.84","TCP","66","62387  >  5201 [ACK] Seq=38 Ack=185345 Win=131072 Len=0 TSval=2935393191 TSecr=195578583"
"234","0.149147","54.210.90.84","192.168.0.13","TCP","1514","5201  >  62387 [ACK] Seq=185345 Ack=38 Win=26880 Len=1448 TSval=195578583 TSecr=2935393171"
"235","0.149149","54.210.90.84","192.168.0.13","TCP","1514","5201  >  62387 [ACK] Seq=186793 Ack=38 Win=26880 Len=1448 TSval=195578583 TSecr=2935393171"
"236","0.149166","192.168.0.13","54.210.90.84","TCP","66","62387  >  5201 [ACK] Seq=38 Ack=186793 Win=129600 Len=0 TSval=2935393191 TSecr=195578583"
"237","0.149192","192.168.0.13","54.210.90.84","TCP","66","62387  >  5201 [ACK] Seq=38 Ack=188241 Win=131072 Len=0 TSval=2935393191 TSecr=195578583"
"238","0.149357","54.210.90.84","192.168.0.13","TCP","1514","5201  >  62387 [ACK] Seq=188241 Ack=38 Win=26880 Len=1448 TSval=195578583 TSecr=2935393171"
"239","0.149360","54.210.90.84","192.168.0.13","TCP","1514","5201  >  62387 [ACK] Seq=189689 Ack=38 Win=26880 Len=1448 TSval=195578583 TSecr=2935393171"
"240","0.149362","54.210.90.84","192.168.0.13","TCP","1514","5201  >  62387 [ACK] Seq=191137 Ack=38 Win=26880 Len=1448 TSval=195578583 TSecr=2935393171"
"241","0.149384","192.168.0.13","54.210.90.84","TCP","66","62387  >  5201 [ACK] Seq=38 Ack=191137 Win=128160 Len=0 TSval=2935393191 TSecr=195578583"
"242","0.149392","54.210.90.84","192.168.0.13","TCP","1514","5201  >  62387 [ACK] Seq=192585 Ack=38 Win=26880 Len=1448 TSval=195578583 TSecr=2935393171"
"243","0.149401","192.168.0.13","54.210.90.84","TCP","66","62387  >  5201 [ACK] Seq=38 Ack=194033 Win=125280 Len=0 TSval=2935393191 TSecr=195578583"
"244","0.149408","192.168.0.13","54.210.90.84","TCP","66","[TCP Window Update] 62387  >  5201 [ACK] Seq=38 Ack=194033 Win=131072 Len=0 TSval=2935393191 TSecr=195578583"
"245","0.149612","54.210.90.84","192.168.0.13","TCP","1514","5201  >  62387 [ACK] Seq=194033 Ack=38 Win=26880 Len=1448 TSval=195578583 TSecr=2935393171"
"246","0.149614","54.210.90.84","192.168.0.13","TCP","1514","5201  >  62387 [ACK] Seq=195481 Ack=38 Win=26880 Len=1448 TSval=195578583 TSecr=2935393171"
"247","0.149616","54.210.90.84","192.168.0.13","TCP","1514","5201  >  62387 [ACK] Seq=196929 Ack=38 Win=26880 Len=1448 TSval=195578583 TSecr=2935393171"
"248","0.149638","192.168.0.13","54.210.90.84","TCP","66","62387  >  5201 [ACK] Seq=38 Ack=196929 Win=128160 Len=0 TSval=2935393191 TSecr=195578583"
"249","0.149646","192.168.0.13","54.210.90.84","TCP","66","[TCP Window Update] 62387  >  5201 [ACK] Seq=38 Ack=196929 Win=131072 Len=0 TSval=2935393191 TSecr=195578583"
"250","0.149735","54.210.90.84","192.168.0.13","TCP","1514","5201  >  62387 [ACK] Seq=198377 Ack=38 Win=26880 Len=1448 TSval=195578583 TSecr=2935393171"
"251","0.149737","54.210.90.84","192.168.0.13","TCP","1514","5201  >  62387 [ACK] Seq=199825 Ack=38 Win=26880 Len=1448 TSval=195578583 TSecr=2935393171"
"252","0.149749","192.168.0.13","54.210.90.84","TCP","66","62387  >  5201 [ACK] Seq=38 Ack=199825 Win=129600 Len=0 TSval=2935393191 TSecr=195578583"
"253","0.149764","192.168.0.13","54.210.90.84","TCP","66","62387  >  5201 [ACK] Seq=38 Ack=201273 Win=131072 Len=0 TSval=2935393191 TSecr=195578583"
"254","0.149857","54.210.90.84","192.168.0.13","TCP","1514","5201  >  62387 [ACK] Seq=201273 Ack=38 Win=26880 Len=1448 TSval=195578583 TSecr=2935393171"
"255","0.149868","192.168.0.13","54.210.90.84","TCP","66","62387  >  5201 [ACK] Seq=38 Ack=202721 Win=129600 Len=0 TSval=2935393191 TSecr=195578583"
"256","0.150044","54.210.90.84","192.168.0.13","TCP","1514","5201  >  62387 [ACK] Seq=202721 Ack=38 Win=26880 Len=1448 TSval=195578583 TSecr=2935393171"
"257","0.150048","54.210.90.84","192.168.0.13","TCP","1514","5201  >  62387 [ACK] Seq=204169 Ack=38 Win=26880 Len=1448 TSval=195578583 TSecr=2935393171"
"258","0.150079","192.168.0.13","54.210.90.84","TCP","66","62387  >  5201 [ACK] Seq=38 Ack=205617 Win=128160 Len=0 TSval=2935393192 TSecr=195578583"
"259","0.150086","192.168.0.13","54.210.90.84","TCP","66","[TCP Window Update] 62387  >  5201 [ACK] Seq=38 Ack=205617 Win=131072 Len=0 TSval=2935393192 TSecr=195578583"
"260","0.150090","54.210.90.84","192.168.0.13","TCP","1514","5201  >  62387 [ACK] Seq=205617 Ack=38 Win=26880 Len=1448 TSval=195578583 TSecr=2935393171"
"261","0.150315","54.210.90.84","192.168.0.13","TCP","1514","5201  >  62387 [ACK] Seq=207065 Ack=38 Win=26880 Len=1448 TSval=195578583 TSecr=2935393171"
